{
  "id": "episode-004",
  "version": 1,
  "level": 4,
  "title": "The Ledger's Weight",
  "series": "HARNESS: Who Do You Trust?",
  "audience": "ages 10-14 and families",
  "expectedMinutes": 20,
  "bestDecisionId": "d_phased_reallocation",
  "briefing": {
    "heading": "Case 4: The Ledger's Weight",
    "paragraphs": [
      "The city budget system recommends moving 35 percent of next month's drain-maintenance money into a new street-cleaning drone program. Its report predicts low flood risk and large savings.",
      "Public works crews disagree. They have photographs of blocked drains in three low-lying neighborhoods, but their inspection list is incomplete and overtime is already high.",
      "The council votes tonight. Keeping every dollar in drainage could delay a useful program. Moving the money could leave vulnerable streets unprepared for a storm the model treats as unlikely."
    ],
    "mission": "Recommend a budget action that weighs model evidence, field evidence, unequal consequences, and the cost of delay.",
    "learningGoal": "Question what a model leaves out, compare predicted averages with local observations, and make tradeoffs visible."
  },
  "advisors": {
    "boy": {
      "name": "BOY",
      "verb": "SEARCHER",
      "strength": "Finds comparable budgets and overlooked records quickly",
      "weakness": "A comparison can look stronger than it is when cities measure costs differently"
    },
    "tooth": {
      "name": "TOOTH",
      "verb": "FACT-CHECKER",
      "strength": "Checks the model's inputs against field inspections",
      "weakness": "A complete audit may take longer than the budget deadline"
    },
    "darth": {
      "name": "LUKE",
      "verb": "WORST-CASE THINKER",
      "strength": "Notices who bears the harm when a low-probability storm arrives",
      "weakness": "Can make rare events dominate every decision"
    },
    "donsol": {
      "name": "DON SOL",
      "verb": "TEAM LEAD",
      "strength": "Connects evidence, budget limits, and the ability to revise the plan",
      "weakness": "A compromise can fail if its checkpoints are vague"
    }
  },
  "advisorOrder": [
    "boy",
    "tooth",
    "darth",
    "donsol"
  ],
  "evidence": [
    {
      "id": "e_budget_model",
      "title": "Budget model recommendation",
      "source": "City Resource Optimizer",
      "clock": "Generated Monday at 8:00 a.m.",
      "hidden": false,
      "summary": "The model recommends shifting 35 percent of drain maintenance to cleaning drones and reports a 7 percent monthly flood chance.",
      "body": [
        "The projected drone savings are based on fewer crew hours and faster litter removal downtown.",
        "The report gives a citywide flood probability. It does not show risk by neighborhood or list excluded weather records."
      ],
      "proves": "The model predicts savings and low average flood risk under its chosen inputs.",
      "doesNotProve": "It does not prove every neighborhood faces the same risk or that its inputs include extreme storms.",
      "art": "evidence_budget_model"
    },
    {
      "id": "e_field_photos",
      "title": "Crew field photos",
      "source": "Public works inspection route",
      "clock": "Taken over the last nine days",
      "hidden": false,
      "summary": "Crews photographed 18 partially blocked drains, including 11 in three low-lying neighborhoods.",
      "body": [
        "Each photo includes a drain ID and time, but only 62 percent of scheduled routes were completed because two trucks were under repair.",
        "The photographs prove local blockages. They do not show the condition of every drain in the city."
      ],
      "proves": "Known blockages are concentrated in places where water already collects.",
      "doesNotProve": "The incomplete route cannot establish the citywide blockage rate.",
      "art": "evidence_field_photos"
    },
    {
      "id": "e_rain_forecast",
      "title": "Thirty-day rainfall outlook",
      "source": "Regional weather service",
      "clock": "Updated Tuesday at 6:00 a.m.",
      "hidden": false,
      "summary": "Total rainfall is expected to be near normal, with a wide uncertainty range and an elevated chance of one intense storm.",
      "body": [
        "The most likely monthly total is ordinary. The outlook gives a 22 percent chance of a storm delivering more than two inches in six hours.",
        "Forecast probabilities describe uncertainty; they are not promises about what will happen."
      ],
      "proves": "An intense storm is not the most likely outcome, but it remains a meaningful possibility.",
      "doesNotProve": "It does not identify which streets would flood or guarantee a storm.",
      "art": "evidence_rain_forecast"
    },
    {
      "id": "e_cost_sheet",
      "title": "Program cost sheet",
      "source": "City finance office",
      "clock": "Current budget proposal",
      "hidden": false,
      "summary": "A full delay costs a nonrefundable drone reservation fee; funding both programs completely would exceed the monthly contingency fund.",
      "body": [
        "The drone vendor requires a 20 percent deposit this week. The city can fund critical drain clearing plus a smaller drone pilot without exceeding the contingency limit.",
        "Any emergency crew overtime later in the month would need a public amendment."
      ],
      "proves": "There is enough money for a smaller pilot and priority drain work, but not both full plans.",
      "doesNotProve": "It does not determine which neighborhoods should receive priority.",
      "art": "evidence_cost_sheet"
    },
    {
      "id": "e_model_notes",
      "title": "Model parameter notes",
      "source": "Optimizer configuration reviewed by BOY and TOOTH",
      "clock": "Training window: previous eight years",
      "hidden": true,
      "summary": "The model removes the two wettest storm days as outliers and averages drain conditions across the whole city.",
      "body": [
        "The notes say extreme days were excluded to stabilize monthly cost predictions. No neighborhood-level flood-loss data was included.",
        "Removing rare values can improve an average prediction while hiding the events that matter most for emergency preparation."
      ],
      "proves": "The low-risk score depends on excluding extreme storms and local differences.",
      "doesNotProve": "It does not prove the recommendation is useless for ordinary months.",
      "art": "evidence_model_notes"
    },
    {
      "id": "e_drain_inspection",
      "title": "Subsurface inspection",
      "source": "Camera check ordered by the public works supervisor",
      "clock": "Completed Tuesday afternoon",
      "hidden": true,
      "summary": "Seven of the 11 photographed low-area drains also have heavy blockage below the street surface.",
      "body": [
        "The camera route covers the three streets with the highest past flood losses. Two pipes are more than 70 percent blocked.",
        "The inspection gives strong local evidence, but it still does not describe uninspected neighborhoods."
      ],
      "proves": "The visible field reports understate the blockage at several high-consequence locations.",
      "doesNotProve": "It does not justify treating every city drain as equally urgent.",
      "art": "evidence_drain_inspection"
    }
  ],
  "advice": {
    "boy": [
      {
        "id": "boy_parameter_notes",
        "when": {
          "inspected": [
            "e_budget_model",
            "e_rain_forecast"
          ]
        },
        "text": "I found the model's parameter notes. The headline score leaves out the two wettest days and averages the whole city together. That does not make the model worthless, but it changes what the 7 percent means.",
        "reveals": [
          "e_model_notes"
        ]
      },
      {
        "id": "boy_city_compare",
        "when": {},
        "text": "Three other cities report savings from street-cleaning drones, but their accounting rules and drainage systems differ. It is a useful comparison, not a copy-and-paste answer."
      }
    ],
    "tooth": [
      {
        "id": "tooth_subsurface",
        "when": {
          "inspected": [
            "e_field_photos",
            "e_model_notes"
          ]
        },
        "text": "The photos are real but incomplete. I asked for a camera inspection at the highest-loss streets. Seven drains are blocked below the surface, including two severe cases. That is independent local evidence the model lacks.",
        "reveals": [
          "e_drain_inspection"
        ]
      },
      {
        "id": "tooth_missing_inputs",
        "when": {},
        "text": "Before trusting a citywide risk number, ask what data was excluded and whether the average hides neighborhoods with much higher consequences."
      }
    ],
    "darth": [
      {
        "id": "darth_targeted_risk",
        "when": {
          "inspected": [
            "e_drain_inspection",
            "e_rain_forecast"
          ]
        },
        "text": "The intense storm is only a 22 percent possibility, but two pipes in known flood streets are more than 70 percent blocked. A low chance multiplied by severe harm still deserves targeted action."
      },
      {
        "id": "darth_freeze",
        "when": {},
        "text": "If the model is wrong and the storm arrives, the lowest streets pay the price. I would protect drainage first, though I may be overweighting the worst month."
      }
    ],
    "donsol": [
      {
        "id": "donsol_phased",
        "when": {
          "inspected": [
            "e_cost_sheet",
            "e_drain_inspection"
          ]
        },
        "text": "The cost sheet supports a smaller drone pilot while crews clear the seven verified underground blockages. Add a public checkpoint after two weeks so the council must review new rain and inspection data before shifting more money."
      },
      {